{
  "accepted_evidence_binding": {
    "binding_boundary": "Accepted semantics are bound to referenced oracle/replay/diff/unsafe evidence; the generated Rust draft remains candidate evidence.",
    "fixture_path": "validation/l2_slices/fixtures/target-abi-ulong-identity-c-oracle.json",
    "fixture_sha256": "c45cf65c6d997e0c62f09be85c0254b58b2c4189256f5cd15d7a0a2f94cc80c6",
    "generated_draft_semantic_pass": false,
    "path_sha256": {
      "c_oracle": "c45cf65c6d997e0c62f09be85c0254b58b2c4189256f5cd15d7a0a2f94cc80c6",
      "diff": "ec3d37ca62d65a0fbd6cec9d7e054a9738b9681b2c3cc940c5b2ff877fe6364f",
      "final_verification": "e1c2fe818e366e7082a9027f39e4b115f8c8610d8e95651716847f67d182a4e5",
      "negative_diff": "88950e67d7d0b936856bec058e3f528e154c5a5495b18fd244cb124eb596b12c",
      "performance_smoke": "7a22d8351d8a3d967857196623a2eb3154389349ba53b9ffe32dbd26f2b9f4c2",
      "rust_report": "ac63cfaeec3c353d397e737375f879b147fe639d8f17c3d0bdae8b6876633fa4",
      "unsafe_ledger": "cbfa2bdbe622649e0cc8ce668fc45217d3f9c42076926028a55685502b5483a1",
      "unsafe_scan": "d4c269f82959565b13e54a6e38c3683fc564524ae25ab40c980a9df69edb70ba",
      "version_manifest": "63cce1ec01917f4508614df6cb45c70b195b4502027a7a8859954ac9d172fbbd"
    },
    "paths": {
      "c_oracle": "validation/evidence/demo/l3-target-abi-ulong-identity-c-oracle.json",
      "diff": "validation/evidence/demo/l3-target-abi-ulong-identity-diff.json",
      "final_verification": "validation/evidence/demo/l3-target-abi-ulong-identity-final-verification.json",
      "negative_diff": "validation/evidence/demo/l3-target-abi-ulong-identity-negative-diff.json",
      "performance_smoke": "validation/evidence/demo/l3-target-abi-ulong-identity-performance-smoke.json",
      "rust_report": "validation/evidence/demo/l3-target-abi-ulong-identity-rust-report.json",
      "unsafe_ledger": "validation/evidence/demo/l3-target-abi-ulong-identity-unsafe-ledger.json",
      "unsafe_scan": "validation/evidence/demo/l3-target-abi-ulong-identity-unsafe-scan.json",
      "version_manifest": "validation/evidence/demo/l3-target-abi-ulong-identity-version-manifest.json"
    },
    "slice_id": "target-abi-ulong-identity",
    "source_commit": "demo-target-abi-ulong-identity-20260708",
    "status": "accepted",
    "target_id": "demo",
    "toolchain_status": "C_ORACLE_GENERATED"
  },
  "blocked_reasons": [
    "c2rust_baseline_not_generated",
    "c2rust_output_missing",
    "c2rust_compile_not_passed",
    "c2rust_compile_artifact_missing",
    "No Rust replay harness currently calls this exact C2Rust output sha."
  ],
  "c2rust_baseline": {
    "path": "validation/evidence/demo/auto-translation/target-abi-ulong-identity/l3-target-abi-ulong-identity-c2rust-baseline-manifest.json",
    "sha256": "592384379bd565d7417dd0c42e1a5cd4d97ec827caa6fe8b05b6af3fa754989a",
    "status": "skipped"
  },
  "c2rust_output": null,
  "claim_boundary": {
    "accepted_evidence_reused": false,
    "compile_only_is_semantic_pass": false,
    "generated_draft_semantic_pass": false,
    "scope": "C2Rust baseline verification status artifact; blocked until direct C2Rust output replay, diff, negative diff, unsafe ledger, and final verification are all bound to the same output.",
    "semantic_pass": false
  },
  "compile_artifact": null,
  "direct_c2rust_replay": {
    "artifact": null,
    "c2rust_output": null,
    "compile_artifact": null,
    "observable_replay_pass": false,
    "reason": "No Rust replay harness currently calls this exact C2Rust output sha.",
    "semantic_pass": false,
    "status": "blocked"
  },
  "entry_function": "target_abi_ulong_identity",
  "fixture": {
    "hash": "target-abi-ulong-identity-fixture",
    "path": "validation/l2_slices/fixtures/target-abi-ulong-identity-c-oracle.json"
  },
  "gate_refs": {
    "c_oracle": {
      "path": "validation/evidence/demo/auto-translation/target-abi-ulong-identity/l3-target-abi-ulong-identity-c-oracle-status.json",
      "sha256": "7c4abcb82c37db8362f86fefe8aaa6d42f6d4409271289dec29e8bd0d007835e",
      "status": "C_ORACLE_GENERATED"
    },
    "final_verification": {
      "path": "validation/evidence/demo/auto-translation/target-abi-ulong-identity/l3-target-abi-ulong-identity-final-verification.json",
      "status": "passed"
    },
    "negative_diff": {
      "path": "validation/evidence/demo/auto-translation/target-abi-ulong-identity/l3-target-abi-ulong-identity-negative-diff.json",
      "sha256": "a69f15f21e3fe701ec67c7b8db0daf3b5984fefa9819d3219932e8be908018bd",
      "status": "passed"
    },
    "rust_replay": {
      "path": "validation/evidence/demo/auto-translation/target-abi-ulong-identity/l3-target-abi-ulong-identity-rust-report.json",
      "sha256": "a54075446afc1801b0dca0f8ebf50111eabcbd3e9259293b41f45e7b3488671e",
      "status": "passed"
    },
    "schema_diff": {
      "path": "validation/evidence/demo/auto-translation/target-abi-ulong-identity/l3-target-abi-ulong-identity-diff.json",
      "sha256": "9990d81e7b435d904d500ffb27a9e5daa1d5ce07dc78cbdd7f57103e4c05e7fc",
      "status": "passed"
    },
    "unsafe_ledger": {
      "path": "validation/evidence/demo/auto-translation/target-abi-ulong-identity/l3-target-abi-ulong-identity-unsafe-ledger.json",
      "sha256": "b198276075642813f2f6503c21722a05ce3323cf758eb1ca9d0c5f6b26036c12",
      "status": "passed"
    },
    "unsafe_scan": {
      "path": "validation/evidence/demo/auto-translation/target-abi-ulong-identity/l3-target-abi-ulong-identity-unsafe-scan.json",
      "sha256": "433bdab937ca0a515502fe8de465e8c9b543b88b25361cb0aa0492b5d30773d1",
      "status": "passed"
    }
  },
  "generated_draft_semantic_pass": false,
  "route_decision": {
    "level": "L0",
    "path": "validation/evidence/demo/auto-translation/target-abi-ulong-identity/l3-target-abi-ulong-identity-route-decision.json",
    "sha256": "87b9250b3f6a6c0dbbc56f4a9d1721d38b786c7579d6121296f812f165e12c3c",
    "status": "recorded"
  },
  "same_output_gate_refs": null,
  "schema_version": 1,
  "semantic_claim_source": "blocked_missing_direct_c2rust_replay",
  "semantic_pass": false,
  "slice_id": "target-abi-ulong-identity",
  "source_commit": "demo-target-abi-ulong-identity-20260708",
  "status": "blocked",
  "target_id": "demo",
  "validation_profile": {
    "path": "validation/evidence/demo/auto-translation/target-abi-ulong-identity/l3-target-abi-ulong-identity-validation-profile.json",
    "profile": "L0-dev",
    "sha256": "ba00224300be1d4f382619b5af767538781d8a1ff348cd0913d7cd05c7ad3eac",
    "status": "passed"
  }
}
