{
  "accepted_evidence_binding": {
    "binding_boundary": "Accepted semantics are bound to referenced oracle/replay/diff/unsafe evidence; the generated Rust draft remains candidate evidence.",
    "fixture_path": "validation/l2_slices/fixtures/external-direct-callee-c-oracle.json",
    "fixture_sha256": "bd927e6af469ce16d37c8119db3421c3d609b6bf9b1f76e4bd081b061e04a22b",
    "generated_draft_semantic_pass": false,
    "path_sha256": {
      "c_oracle": "bd927e6af469ce16d37c8119db3421c3d609b6bf9b1f76e4bd081b061e04a22b",
      "diff": "25b25cd3c8c06c52aff6257b4d0fdc39ee6a62dce282ed714a36f062cd7855fd",
      "final_verification": "f6951d5a898457af0ec94ad99100833ef2adf0107ed1d50369f1734cc6d216d9",
      "negative_diff": "666613c9f2a097a36d636b55dba3eb292b7307d8c739c7e77e37dfd006623288",
      "performance_smoke": "503ccf8f675d18e1ded9a94fb391ed066263add47b22b05ab52e757aa2c9ca93",
      "rust_report": "9b2e743b35e7e9bc3a38c74abcd4c191d147e48fda0d55e16202f494f870cfed",
      "unsafe_ledger": "2fe75734941305cbc1a7ad536d868127a0872280bb2a5f9854791bdfdaaf35d5",
      "unsafe_scan": "587e4cf9d97b84ded264c3314b8c02525882c66e694b1cb7dbe6893f9c07f73e",
      "version_manifest": "bc208abbae000a08cb7ed3fd7d825b8bc4b9e41f34e118d93718f0edd3f8edfe"
    },
    "paths": {
      "c_oracle": "validation/evidence/demo/l3-external-direct-callee-c-oracle.json",
      "diff": "validation/evidence/demo/l3-external-direct-callee-diff.json",
      "final_verification": "validation/evidence/demo/l3-external-direct-callee-final-verification.json",
      "negative_diff": "validation/evidence/demo/l3-external-direct-callee-negative-diff.json",
      "performance_smoke": "validation/evidence/demo/l3-external-direct-callee-performance-smoke.json",
      "rust_report": "validation/evidence/demo/l3-external-direct-callee-rust-report.json",
      "unsafe_ledger": "validation/evidence/demo/l3-external-direct-callee-unsafe-ledger.json",
      "unsafe_scan": "validation/evidence/demo/l3-external-direct-callee-unsafe-scan.json",
      "version_manifest": "validation/evidence/demo/l3-external-direct-callee-version-manifest.json"
    },
    "slice_id": "external-direct-callee",
    "source_commit": "demo-external-direct-callee-20260625",
    "status": "accepted",
    "target_id": "demo",
    "toolchain_status": "C_ORACLE_GENERATED"
  },
  "blocked_reasons": [
    "c2rust_baseline_not_generated",
    "c2rust_output_missing",
    "c2rust_compile_not_passed",
    "c2rust_compile_artifact_missing",
    "No Rust replay harness currently calls this exact C2Rust output sha."
  ],
  "c2rust_baseline": {
    "path": "validation/evidence/demo/auto-translation/external-direct-callee/l3-external-direct-callee-c2rust-baseline-manifest.json",
    "sha256": "8167005071a9d661db83995ff9f567c32c87e83afabdb469c808f5d599d49804",
    "status": "skipped"
  },
  "c2rust_output": null,
  "claim_boundary": {
    "accepted_evidence_reused": false,
    "compile_only_is_semantic_pass": false,
    "generated_draft_semantic_pass": false,
    "scope": "C2Rust baseline verification status artifact; blocked until direct C2Rust output replay, diff, negative diff, unsafe ledger, and final verification are all bound to the same output.",
    "semantic_pass": false
  },
  "compile_artifact": null,
  "direct_c2rust_replay": {
    "artifact": null,
    "c2rust_output": null,
    "compile_artifact": null,
    "observable_replay_pass": false,
    "reason": "No Rust replay harness currently calls this exact C2Rust output sha.",
    "semantic_pass": false,
    "status": "blocked"
  },
  "entry_function": "call_helper_chain",
  "fixture": {
    "hash": "external-direct-callee-fixture",
    "path": "validation/l2_slices/fixtures/external-direct-callee-c-oracle.json"
  },
  "gate_refs": {
    "c_oracle": {
      "path": "validation/evidence/demo/auto-translation/external-direct-callee/l3-external-direct-callee-c-oracle-status.json",
      "sha256": "06341df7bb59febee11e8f39fbbc1d19e08e9f22fbd727f2c5ba28a31e4f29dd",
      "status": "C_ORACLE_GENERATED"
    },
    "final_verification": {
      "path": "validation/evidence/demo/auto-translation/external-direct-callee/l3-external-direct-callee-final-verification.json",
      "status": "passed"
    },
    "negative_diff": {
      "path": "validation/evidence/demo/auto-translation/external-direct-callee/l3-external-direct-callee-negative-diff.json",
      "sha256": "d4dfea35c64237ab3c8d093a7120db79fa8b2dc1888c26a05b6b7eb36cd680fa",
      "status": "passed"
    },
    "rust_replay": {
      "path": "validation/evidence/demo/auto-translation/external-direct-callee/l3-external-direct-callee-rust-report.json",
      "sha256": "77ba8afb655d70ea1438d70a5395ac4c79d1ee5a5a77162778dde47a4a3a4db9",
      "status": "passed"
    },
    "schema_diff": {
      "path": "validation/evidence/demo/auto-translation/external-direct-callee/l3-external-direct-callee-diff.json",
      "sha256": "e4077f7f1fad44299555688b1e58cd6a466fae26bcc8177c067bb1d48d0ee9a4",
      "status": "passed"
    },
    "unsafe_ledger": {
      "path": "validation/evidence/demo/auto-translation/external-direct-callee/l3-external-direct-callee-unsafe-ledger.json",
      "sha256": "b8627a014197b79ffa53f90225b5f8c5ebae608f5092f5a97a7b1340146d700e",
      "status": "passed"
    },
    "unsafe_scan": {
      "path": "validation/evidence/demo/auto-translation/external-direct-callee/l3-external-direct-callee-unsafe-scan.json",
      "sha256": "3ccf60eaad17bb4eae061251035b8635c0465d468b3a240d27918ef6d46ec723",
      "status": "passed"
    }
  },
  "generated_draft_semantic_pass": false,
  "route_decision": {
    "level": "L0",
    "path": "validation/evidence/demo/auto-translation/external-direct-callee/l3-external-direct-callee-route-decision.json",
    "sha256": "00706c0f458c7a5a7c590417d90378722f9ed6615570304e6a66efccf2dc9728",
    "status": "recorded"
  },
  "same_output_gate_refs": null,
  "schema_version": 1,
  "semantic_claim_source": "blocked_missing_direct_c2rust_replay",
  "semantic_pass": false,
  "slice_id": "external-direct-callee",
  "source_commit": "demo-external-direct-callee-20260625",
  "status": "blocked",
  "target_id": "demo",
  "validation_profile": {
    "path": "validation/evidence/demo/auto-translation/external-direct-callee/l3-external-direct-callee-validation-profile.json",
    "profile": "L0-dev",
    "sha256": "3d5df8fa878d83a8b6052a7f61657b38f788ba4469a7046749d044dbc037575f",
    "status": "passed"
  }
}
