{
  "accepted_evidence_binding": {
    "binding_boundary": "Accepted semantics bind independent oracle/replay/diff evidence and stable generated-draft unsafe gates; final accepted reports are downstream and cannot hash-bind themselves.",
    "fixture_path": "validation/l2_slices/fixtures/real-fdb-kv-iterate-sector-start.json",
    "fixture_sha256": "77d4cc12cc9d54fccc1f3969e0f60a85a2f33d8fe84320914dd408ac6d7a51ce",
    "generated_draft_semantic_pass": false,
    "path_sha256": {
      "c_oracle": "95d560ad725bb89522664784f940b864623ed87049f7b166a21f24d174f12c19",
      "diff": "5b6f351a04f4913b452fea7aec69119ac7e4e012a0b64f96923ed9999fff31bd",
      "negative_diff": "bd1677af08f41b19bd9799e86737bf4dfe260144dd9c93401409abf78212e5d1",
      "rust_report": "37efb0f657beab801270be1ebeac1344cf3857f958bb0c60682d056d9d14e37c",
      "unsafe_ledger": "fd0f0503540e9f741994c29797122d7bfac1d164f53800d3372aa2cc90dba0d4",
      "unsafe_scan": "bca541e22b6d926a71cab7179e978947eaae9366887c1033b52e5d72e79a549a"
    },
    "paths": {
      "c_oracle": "validation/evidence/flashdb/l3-real-fdb-kv-iterate-sector-start-c-oracle.json",
      "diff": "validation/evidence/flashdb/l3-real-fdb-kv-iterate-sector-start-diff.json",
      "negative_diff": "validation/evidence/flashdb/l3-real-fdb-kv-iterate-sector-start-negative-diff.json",
      "rust_report": "validation/evidence/flashdb/l3-real-fdb-kv-iterate-sector-start-rust-report.json",
      "unsafe_ledger": "validation/evidence/flashdb/auto-translation/real-fdb-kv-iterate-sector-start/l3-real-fdb-kv-iterate-sector-start-generated-draft-unsafe-ledger.json",
      "unsafe_scan": "validation/evidence/flashdb/auto-translation/real-fdb-kv-iterate-sector-start/l3-real-fdb-kv-iterate-sector-start-generated-draft-unsafe-scan.json"
    },
    "slice_id": "real-fdb-kv-iterate-sector-start",
    "source_commit": "f9d0421315c564fb890a1b14eee77b290e0d7bbe",
    "status": "accepted",
    "target_id": "flashdb",
    "toolchain_status": "C_ORACLE_GENERATED",
    "unsafe_gate_source": "generated_draft_unsafe_gates"
  },
  "blocked_reasons": [
    "c2rust_baseline_not_generated",
    "c2rust_output_missing",
    "c2rust_compile_not_passed",
    "c2rust_compile_artifact_missing",
    "No Rust replay harness currently calls this exact C2Rust output sha."
  ],
  "c2rust_baseline": {
    "path": "validation/evidence/flashdb/auto-translation/real-fdb-kv-iterate-sector-start/l3-real-fdb-kv-iterate-sector-start-c2rust-baseline-manifest.json",
    "sha256": "09f88eb1c5e9c4b0186fb37c7e11d3b0e13c7819d76069c28529bd4a455e016c",
    "status": "skipped"
  },
  "c2rust_output": null,
  "claim_boundary": {
    "accepted_evidence_reused": false,
    "compile_only_is_semantic_pass": false,
    "generated_draft_semantic_pass": false,
    "scope": "C2Rust baseline verification status artifact; blocked until direct C2Rust output replay, diff, negative diff, unsafe ledger, and final verification are all bound to the same output.",
    "semantic_pass": false
  },
  "compile_artifact": null,
  "direct_c2rust_replay": {
    "artifact": null,
    "c2rust_output": null,
    "compile_artifact": null,
    "observable_replay_pass": false,
    "reason": "No Rust replay harness currently calls this exact C2Rust output sha.",
    "semantic_pass": false,
    "status": "blocked"
  },
  "entry_function": "fdb_kv_iterate_sector_start_probe",
  "fixture": {
    "hash": "77d4cc12cc9d54fccc1f3969e0f60a85a2f33d8fe84320914dd408ac6d7a51ce",
    "path": "validation/l2_slices/fixtures/real-fdb-kv-iterate-sector-start.json"
  },
  "gate_refs": {
    "c_oracle": {
      "path": "validation/evidence/flashdb/auto-translation/real-fdb-kv-iterate-sector-start/l3-real-fdb-kv-iterate-sector-start-c-oracle-status.json",
      "sha256": "bc76c649e8b7b10b0d26644eddc1c191c91cd5ad0172533bad30674e9db72092",
      "status": "C_ORACLE_GENERATED"
    },
    "final_verification": {
      "path": "validation/evidence/flashdb/auto-translation/real-fdb-kv-iterate-sector-start/l3-real-fdb-kv-iterate-sector-start-final-verification.json",
      "status": "passed"
    },
    "negative_diff": {
      "path": "validation/evidence/flashdb/auto-translation/real-fdb-kv-iterate-sector-start/l3-real-fdb-kv-iterate-sector-start-negative-diff.json",
      "sha256": "150af9a97b8d028b5bb618b32f662b05de86f4e51fa68758e1c60ee461402d50",
      "status": "passed"
    },
    "rust_replay": {
      "path": "validation/evidence/flashdb/auto-translation/real-fdb-kv-iterate-sector-start/l3-real-fdb-kv-iterate-sector-start-rust-report.json",
      "sha256": "f7b5ff9af93c18469f764791ff4082cd5db0952bd652da271511127c6782a021",
      "status": "passed"
    },
    "schema_diff": {
      "path": "validation/evidence/flashdb/auto-translation/real-fdb-kv-iterate-sector-start/l3-real-fdb-kv-iterate-sector-start-diff.json",
      "sha256": "f22c855d71b11f7bc92362c6f614d2264508461cd5501d08ad6e62c407b89a94",
      "status": "passed"
    },
    "unsafe_ledger": {
      "path": "validation/evidence/flashdb/auto-translation/real-fdb-kv-iterate-sector-start/l3-real-fdb-kv-iterate-sector-start-unsafe-ledger.json",
      "sha256": "e0bd7c846a67e8e188d9c72c1fc143e2a7ec711908fdddcb5bc28d6d21f6a1c2",
      "status": "passed"
    },
    "unsafe_scan": {
      "path": "validation/evidence/flashdb/auto-translation/real-fdb-kv-iterate-sector-start/l3-real-fdb-kv-iterate-sector-start-unsafe-scan.json",
      "sha256": "223ff44271cd54e96379b56d788e97a8b8b9098e10e666f50f2d51613f7fb542",
      "status": "passed"
    }
  },
  "generated_draft_semantic_pass": false,
  "route_decision": {
    "level": "L1",
    "path": "validation/evidence/flashdb/auto-translation/real-fdb-kv-iterate-sector-start/l3-real-fdb-kv-iterate-sector-start-route-decision.json",
    "sha256": "336e2c38bb58aad7a79dcf356a831f2cd4b5cc7f2d41060e7e9f9bba207096ee",
    "status": "recorded"
  },
  "same_output_gate_refs": null,
  "schema_version": 1,
  "semantic_claim_source": "blocked_missing_direct_c2rust_replay",
  "semantic_pass": false,
  "slice_id": "real-fdb-kv-iterate-sector-start",
  "source_commit": "f9d0421315c564fb890a1b14eee77b290e0d7bbe",
  "status": "blocked",
  "target_id": "flashdb",
  "validation_profile": {
    "path": "validation/evidence/flashdb/auto-translation/real-fdb-kv-iterate-sector-start/l3-real-fdb-kv-iterate-sector-start-validation-profile.json",
    "profile": "L1-dev",
    "sha256": "a698010112e4b03c8e5dfe157861036bdcbcccca92d2d7fdc062dc2153b8d963",
    "status": "passed"
  }
}
